;pdf_name;page_nr;page_section;climate_related_no;climate_related_yes;domain_MetricsTargets;domain_RiskManagement;domain_Strategy;domain_Governance;ron_risk;ron_opportunity;ron_neutral;transition_risk_label;text
251;Commerzbank_2022_EN-2;17;3;0.960412323474884;0.03958764299750328;;;;;;;;;In 2022, Commerzbank participat ed in 71 ESG-/Sustainability- linked syndicated loans for companies in Western Europe with a total volume of €103.8bn The „klimaVest“ is the first open-ended real asset fund in the field of renewable energies for private investors.
252;Commerzbank_2022_EN-2;18;0;0.9504071474075317;0.049592867493629456;;;;;;;;;To our Shareholders Corporate Responsibility Management Report Risk Report Fina ncial Statements Further Information 59 25 Declaration on corporate governance pursuant to Art. 315d in conjunction with Art. 289f of the German Commercial Code (HGB) 36 Details pursuant to Art.
253;Commerzbank_2022_EN-2;18;0;0.9185898303985596;0.08141025900840759;;;;;;;;;315 of the German Commercial Code (HGB) 42 Non-financial report In 2021, it became one of the firs t open-ended real estate funds to promote environmental and/or social objectives pursuant to Article 8 of the Disclosure Regulation. The fund has expanded its investment strategy accordingly. The aim is to reduce the portfolio’s CO 2 footprint to 14 kilogrammes per square meter by 2050.
254;Commerzbank_2022_EN-2;18;0;0.9041929244995117;0.09580712765455246;;;;;;;;;In August 2022, hausInvest decided to meet the requirement level for environmentally sustai nable investments under the EU taxonomy and the minimum requirements for sustainable investments for the purposes of the EU Disclosure Regulation. The taxonomy states that their minimu m share is 5% of the fair value of the real estate belonging to th e special fund.
255;Commerzbank_2022_EN-2;18;0;0.9830141067504883;0.016985906288027763;;;;;;;;;In determining the fair value mentioned above, project developments are included from the time of their completion and properties held by real estate companies are included in proportion to their ownership interest. Trading or offsetting emissions Commerzbank Aktiengesellschaft is a participant in the European Emissions Trading Scheme (EU ETS) and the UK Emissions Trading Scheme (UK ETS).
256;Commerzbank_2022_EN-2;18;1;0.9721336364746094;0.027866333723068237;;;;;;;;;It advises companies on the procurement of carbon emissions rights and on the associated risk management aspects, and helps to implement the resulting trading strategies. In addition, there is the option of voluntarily offsetting a company’s unavoidable carbon emissions with certificates from emission reduction projects.
257;Commerzbank_2022_EN-2;18;1;0.7908706068992615;0.20912936329841614;;;;;;;;;As a member of the World Bank’s Carbon Pricing Leadership Coalition (CPLC), the Bank also participates in the global debate on carbon pricing. In equipment leasing, Commerz Real has started to anchor sustainability in its business via its subsidiary Commerz Real Mobilienleasing (CRML).
258;Commerzbank_2022_EN-2;18;1;0.002952993381768465;0.9970470070838928;0.06122548505663872;0.08995964378118515;0.8392062783241272;0.009608563035726547;0.11313609778881073;0.06092951446771622;0.8259344100952148;;CRML’s PRO Climate Lease also offers the option to support projects aimed at avoiding or absorbing CO 2 emissions in parallel with the financing business. Ensuring data security The protection of customer data and compliance with banking secrecy requirements are of the utmost importance in this era of increasing digitalisation.
259;Commerzbank_2022_EN-2;18;1;0.8337180018424988;0.16628196835517883;;;;;;;;;They ar e fundamental to the satisfaction of our customers and to trust within a long-term business relationship. That is why data se curity is a key issue for us in terms of responsible banking. Responding to cyber crime With the increasing digital netw orking of state, business and society, cyber security and resilience are becoming more and more important.
260;Commerzbank_2022_EN-2;18;1;0.9422128796577454;0.057787150144577026;;;;;;;;;Commerzbank scrutinises not only its own information, premises and IT systems, but also those of its customers and service providers, including any independent transport routes. C y b e r s e c u r i t y i s a s t r o n g d r i v e r o f c u s t o m e r c o n f i d e n c e a n d thus an important competitive factor.
261;Commerzbank_2022_EN-2;18;2;0.921842098236084;0.07815790176391602;;;;;;;;;As part of the critical infrastructure, the financial industry is subject to enhanced legal requirements. We want to adequately address both this trend and future challenges relating to the management of cyber risks.
262;Commerzbank_2022_EN-2;18;2;0.9195658564567566;0.08043414354324341;;;;;;;;;Cyber and information security risks are managed by the Group division Group Risk Management – Cyber Risk & Information Security (GRM-CRIS), which reports to the Group Chief Information Security Officer.
263;Commerzbank_2022_EN-2;18;2;0.8974109292030334;0.10258907079696655;;;;;;;;;In addition to established security functions such as the Information Security Mana gement System, the focus is on managing cyber risk appropriately and on strengthening Commerzbank’s cyber-resilience (including its information security incident management capabilities). To cover the human element, we also rely on our employees being highly security and risk-conscious.
264;Commerzbank_2022_EN-2;18;2;0.8013887405395508;0.19861121475696564;;;;;;;;;We promote this via a special, multi-award- winning information security awareness campaign. GRM-CRIS also addresses the interplay between cyber and information security risks and other types of risk relating to areas such as HR, procurement, BCM and physical security.
265;Commerzbank_2022_EN-2;18;2;0.8984355926513672;0.10156435519456863;;;;;;;;;Commerzbank Aktiengesellschaft is a foundi n g m e m b e r o f t h e G e r m a n Competence Centre against Cybercrime (G4C) association, which collaborates with the Federal Criminal Police Office. The association’s aim is to develop and optimise measures to counteract cyber crime in order to protect its members and their customers against damage.
266;Commerzbank_2022_EN-2;18;3;0.8811138868331909;0.11888604611158371;;;;;;;;;mBank also attaches great importance to the security of its IT systems and the data they co ntain, deploying suitable organisational and technical solutions. Every employee of mBank i n P o l a n d i s r e q u i r e d t o c o m p l e t e c y b e r s e c u r i t y t r a i n i n g o n c e a year. The bank’s security department also includes a 24-hour security operations centre (SOC).
267;Commerzbank_2022_EN-2;18;3;0.9654608964920044;0.0345391109585762;;;;;;;;;Employees and customers can report all cyber security matters to the SOC, including identified incidents, attempted attacks and suspicious transactions. mBank also offers free support in the event of cyber incidents when customers have been vi ctims of cyber crime.
268;Commerzbank_2022_EN-2;18;3;0.9172155857086182;0.08278441429138184;;;;;;;;;Ensuring data protection Commerzbank Aktiengesellschaft takes the protection of personal data very seriously and compli es with the applicable data protection rules, in particular the provisions of the EU General Data Protection Regulation and th e Group Data Protection Policy. Data security plays a key role in responsible banking.
269;Commerzbank_2022_EN-2;19;0;0.9502745866775513;0.04972543567419052;;;;;;;;;60 Commerzbank Annual Report 2022 The purpose of this policy is to ensure a consistently high level of data protection in the Grou p and to respect the fundamental rights and freedoms of data subjects over the long term. It includes principles applicable Group-wide for the collection, processing, use and international transmission of personal data.
270;Commerzbank_2022_EN-2;19;0;0.8841100931167603;0.11588990688323975;;;;;;;;;Making sparing, proportionate, necessary use of personal data only within the legally permissible limits is a right under the Charter of Fundamental Rights of the European Union, to which Commerzbank is expressly commi tted. This also includes processing only for a specific purpose and ensuring transparency towards and the provision of information to the data subject.
271;Commerzbank_2022_EN-2;19;0;0.9581551551818848;0.04184488579630852;;;;;;;;;"Commerzbank also transfers personal data to third parties only if this is lawful and it is not apparent that there is a risk to the fundamental rights and freedoms of the data subject; this includes transfers of personal data to auth orities. Personal data is deleted as soon as it is no longer required for business purposes and there is no other legitimate reason preventing deletion."
272;Commerzbank_2022_EN-2;19;0;0.9010829329490662;0.09891713410615921;;;;;;;;;We can demonstrate that we comply ov er time with the principles governing the processing of personal data. Commerzbank investigates inquiries, complaints, requests for information and breaches of personal data protection without delay and keeps in close communication with the data subject, especially when there may be risks to their fundamental rights and freedoms.
273;Commerzbank_2022_EN-2;19;0;0.9931682348251343;0.006831786595284939;;;;;;;;;In addition, data subjects can contact Commerzbank’s data protection officer at any time. To raise our employees’ awareness of data privacy and data security issues and keep them informed, there are regular training sessions and mandatory educational programmes. Commerzbank’s data protection officer is responsible for data protection management for the comdirect brand.
274;Commerzbank_2022_EN-2;19;1;0.9589487910270691;0.041051238775253296;;;;;;;;;Commerz Real has a central data protection officer and data protection coordinators in the departments. In Poland, mBank’s data protection officer and the associ ated team support the bank’s business units, based on the Person al Data Security Policy and the Policy for Personal Data Management over Time. Given that the Bank has almost 11 million customers in Germany and around 5.
275;Commerzbank_2022_EN-2;19;1;0.9088038802146912;0.09119610488414764;;;;;;;;;7 million in Poland, the Czech Republic and Slovakia, plus around 26,000 corporate customer associations, groups, financial service providers and institutional customers worldwide, the number of data protection complaints was again comparatively low in 2022.
276;Commerzbank_2022_EN-2;19;1;0.9268003702163696;0.07319961488246918;;;;;;;;;For example, the data protection officer of Commerzbank Aktiengesellschaft in Germany received 199 customer complaints in the year under review. In most cases, the complaint was that data had been put to unauthoris ed use or had become known to third parties. Using big data responsibly The use of big data and advanced analytics (BDAA) is of central strategic importance for Commerzban k.
277;Commerzbank_2022_EN-2;19;1;0.9372166395187378;0.06278333067893982;;;;;;;;;Efficient and holistic data processing offers great opportunities for all segments and Group divisions: as a basis for decision-making in the management of operational processes, for more detailed and faster analysis, and for improved service and cross-selling.
278;Commerzbank_2022_EN-2;19;1;0.9472386240959167;0.05276133865118027;;;;;;;;;In addition, BDAA provides methods for efficiently designing Group-wide models to calculate credit and operational risk as well as capital requirements, and to perform stress testing. This helps to ensure regulatory compliance and improve capital efficiency.
279;Commerzbank_2022_EN-2;19;2;0.945866048336029;0.05413396656513214;;;;;;;;;To comply with the high data protection standards, Commerzbank Aktiengesellschaft works with pseudonymisation, anonymisation and micro-segmentation. Maintaining dialogue For us, product transparency and fairness towards our customers mean providing holistic and comprehensible advice on financial products, their risks and possible alternatives in accordance with long-term needs.
280;Commerzbank_2022_EN-2;19;2;0.9563964605331421;0.04360349848866463;;;;;;;;;This also includes documenting the advisory process in transparent fashion. In recent years, we have introduced new products and serv ices with particular customer benefits. These include a green ecosystem, green mortgage loans and the new “money mate” investment solution. All units of the Group get thei r customers actively involved.
281;Commerzbank_2022_EN-2;19;2;0.9710975885391235;0.028902456164360046;;;;;;;;;Experts communicate with customers through various channels to ensure that their ideas and suggestions are taken into account when developing products and services. The Commerzbank Aktiengesellschaft UX Studio supports this process with insights into users’ needs and expectations. UX stands for user experience, i.e. the customer’s experience before, during and after their use of a product.
282;Commerzbank_2022_EN-2;19;3;0.9662535786628723;0.033746387809515;;;;;;;;;The purpose of the data protection policy is to ensure a consistently high level of data protection and to respect the fundamental rights and freedoms of affected persons sustainablyThe efficient and holistic processing of data offers great opportunities.
283;Commerzbank_2022_EN-2;20;0;0.9504071474075317;0.049592867493629456;;;;;;;;;To our Shareholders Corporate Responsibility Management Report Risk Report Fina ncial Statements Further Information 61 25 Declaration on corporate governance pursuant to Art. 315d in conjunction with Art. 289f of the German Commercial Code (HGB) 36 Details pursuant to Art.
284;Commerzbank_2022_EN-2;20;0;0.9185898303985596;0.08141025900840759;;;;;;;;;315 of the German Commercial Code (HGB) 42 Non-financial report In UX research studies, customers, non-customers and employees are involved at an early stage in the entire development process and in live operations to ensure offerings are customer-focused.
285;Commerzbank_2022_EN-2;20;0;0.9601647257804871;0.03983519971370697;;;;;;;;;The comdirect brand carries out ac tivities to foster customer loyalty that are based in part on the “comdirect community”, where customers and others with an interest in the financial markets can discuss products and other financial topics with the Bank.
286;Commerzbank_2022_EN-2;20;0;0.8984355926513672;0.10156435519456863;;;;;;;;;Commerzbank Aktiengesellschaft’ s Corporate Clients segment conducts regular customer surveys on specific topics in order to develop its range of products and services. This provides us with information on customer preferences and requirements, which can be used in the design of products and processes.
287;Commerzbank_2022_EN-2;20;0;0.9020135402679443;0.09798645973205566;;;;;;;;;In addition, Commerzbank Aktien gesellschaft actively involves its customers through various customer advisory councils.
288;Commerzbank_2022_EN-2;20;0;0.9831432700157166;0.016856741160154343;;;;;;;;;In a central advisory council and te n regional advisory councils, selected figures from companies, institutions and public life have the opportunity to ente r into direct dialogue with the Board of Managing Directors, find out about the performance of the business and contribute their experience and expectations.
289;Commerzbank_2022_EN-2;20;0;0.9714668989181519;0.02853308618068695;;;;;;;;;Surveying target groups SME topics are at the heart of Commerzbank’s “Unternehmer- perspektiven” initiative (“Business Owners’ Views”). Once a year it surveys owners and top-level managers from companies of different sizes and from diffe rent industries.
290;Commerzbank_2022_EN-2;20;1;0.9776836633682251;0.022316336631774902;;;;;;;;;In 2022, 300 companies were surveyed for a study entitled “Wirtschaft im Umbruch: nachhaltig und digital” (“Economy in turmoil: sustainable and digital”) about the status of their sustainability implementation in the face of the multiple crises th at are currently occurring.
291;Commerzbank_2022_EN-2;20;1;0.9631566405296326;0.036843303591012955;;;;;;;;;In addition, the study provides answers to questions on how companies are dealing with data today and the role played by digital ethics in this. The results also show the opportunities associated with digitalisation, an d which digital technologies are relevant for corporate customers today and going forward.
292;Commerzbank_2022_EN-2;20;1;0.9448145627975464;0.055185411125421524;;;;;;;;;In the business owners’ study, Commerzbank Aktiengesellschaft surv eys 2,500 companies from across Germany with annual sales of up to €15m. They include freelancers, self- employed people, tradespeople, and small and medium-sized enterprises. Some are customers of Commerzbank, while others bank elsewhere. The 2022 study was on the topic of cyber security.
293;Commerzbank_2022_EN-2;20;1;0.9824969172477722;0.017503103241324425;;;;;;;;;The results show that the companies surveyed consider this to be a very important issue. Around two in five companies in Germany have already been the victim of a cyber attack, with nearly one in five affe cted companies suffering losses as a result of the attack. Nevertheless, the vast majority of companies feel they are well-positioned when it comes to cyber security.
294;Commerzbank_2022_EN-2;20;2;0.898262083530426;0.10173794627189636;;;;;;;;;Improving advisory services With the amendment of the MiFID II Directive as part of the EU Action Plan on Financing Sustainable Growth, it became mandatory in August 2022 to ask about sustainability preferences when providing investment advisory and financial portfolio management services. Our investment advisory teams received intensive training on this topic.
295;Commerzbank_2022_EN-2;20;2;0.919127345085144;0.08087264001369476;;;;;;;;;As part of the fact-finding stage, we educate customers about the three sustainability standards defined in the guideline and ask about their sustainability preferences. Where they have a sustainability preference, customers subsequently decide on the share of their investments to be put into sustainable assets .
296;Commerzbank_2022_EN-2;20;2;0.9934493899345398;0.006550674792379141;;;;;;;;;The advisory universe in the Private and Small-Business Customers segment comprises some 500 financial instruments that meet at least one of the sustainability standards defined by MiFID II. Commerzbank Aktiengesellschaft is building up a green ecosystem for sustainability-related issues that lie outside our core competencies.
297;Commerzbank_2022_EN-2;20;2;0.9928217530250549;0.007178240921348333;;;;;;;;;The Bank’s expert cooperation partners provide support in the form of cons ulting services, for example determining a company’s carbon footprint, developing a specific sustainability strategy, or identifying and managing climate risks. I n t h i s w a y , w e h a v e a l r e a d y b e e n a b l e t o h e l p m a n y c u s t o m e r s since the programme was laun ched at the start of 2022.
298;Commerzbank_2022_EN-2;20;2;0.9502383470535278;0.04976163059473038;;;;;;;;;To make Commerzbank’s products and services available to all interested parties, we also go to great lengths to ensure that our branches and online offering ar e fully accessible. Around two- thirds of our branches are accessible at ground level. We strive to ensure accessibility for all user groups where possible whenever we renovate a branch or install an ATM.
299;Commerzbank_2022_EN-2;20;3;0.9731071591377258;0.026892784982919693;;;;;;;;;For dispensing cash, all of Commerzbank Aktiengesellschaft’ s ATMs have a read-aloud function for visually impaired people. Further information on our efforts to be inclusive, including towards our employees, can be found under “Driving inclusion”.
300;Commerzbank_2022_EN-2;20;3;0.008182777091860771;0.9918172955513;0.04020145907998085;0.1407054364681244;0.7957107424736023;0.0233823973685503;0.21226216852664948;0.3455968499183655;0.44214102625846863;;Private customers can use a CO 2 calculator in the banking app to work out their personal carbon footprint based on a questionnaire about their mobility and consumption habits and living situation. This application is supplemented by information on sustainable lifestyles and sustainable product offerings from Commerzbank .
301;Commerzbank_2022_EN-2;20;3;0.9633140563964844;0.0366859957575798;;;;;;;;;The involvement of our customers is a guiding principle for our actions Some 500 financial instruments in the Private and Corporate Clients segment meet at leas t one of the sustainability standards defined by MiFID-2.
302;Commerzbank_2022_EN-2;21;0;0.9584739208221436;0.041526030749082565;;;;;;;;;62 Commerzbank Annual Report 2022 5. Leading by example As a company, we have a responsibility towards the environment a n d s o c i e t y . T h a t i s w h y w e n o t o n l y w a n t t o s u p p o r t o u r customers in their transformations, but also to set a good example ourselves. We will achieve this, among other ways, by continuously reducing our environmental footprint.
303;Commerzbank_2022_EN-2;21;0;0.8770606517791748;0.1229393482208252;;;;;;;;;At the same time we want to be a reliable partner for our stakeholders, and our actions are guided by ethical values such as integrity and fairness. In addition, we take our responsibility as an employer seriously and promote diversity and equal opportunities in practice. Lastly, we positively influence our environment through our voluntary commitment to charitable ca uses and our foundations.
304;Commerzbank_2022_EN-2;21;0;0.004032278433442116;0.9959677457809448;0.4790705144405365;0.02066888101398945;0.48979705572128296;0.010463546961545944;0.09376952797174454;0.07253888994455338;0.8336915969848633;;Reducing operational emissions Commerzbank Aktiengesell- schaft has had an ISO 14001- certified environmental management system in place ever since 2009. In 2015, we added an energy manage ment system certified to ISO 50001, establishing an integrat ed environmental and energy management system (iUEMS).
305;Commerzbank_2022_EN-2;21;0;0.9210765361785889;0.07892345637083054;;;;;;;;;This defines the responsibilities, behaviour, processes and specifications for the implementation of the operational environmental and energy policy and documents them in a structured manner. The focus is on optimising resource consumption, particularly where we can have a direct impact on the environment, such as in building management and business trips.
306;Commerzbank_2022_EN-2;21;1;0.8397241830825806;0.16027574241161346;;;;;;;;;First and foremost, the iUEMS serves to continuously improve our own environmental and energy performance. At the same time, it helps minimise risk: by regularly observing and checking the current situation, any need for action can be id entified at an early stage and preventive measures can be taken.
307;Commerzbank_2022_EN-2;21;1;0.8912521600723267;0.10874782502651215;;;;;;;;;This integrated management system forms an ideal basis for ensuring the business has a sustainable orientation. We can achieve savings in our operational emissions through efficient and sustainable building management in particular, and we are taking various measures to achieve this.
308;Commerzbank_2022_EN-2;21;1;0.9486499428749084;0.05135006085038185;;;;;;;;;These include gradually replacing conventional light sources with LEDs since 2017, making a significant contri bution to energy saving. We continuously review the energy efficiency of our buildings using defined energy performance indicators. We have succeeded in reducing the electricity consumption measure for the space we lease in the Lateral Towers from 104kWh/m 2 in 2018 to 72kWh/m2 in 2022.
309;Commerzbank_2022_EN-2;21;1;0.8537328839302063;0.14626705646514893;;;;;;;;;Following this positive exp erience, we have also put such software into operation at other sites and are continuously examining implementation in further buildings. In addition, special attention is paid to making travel activities as environmentally friendly as possible and thus preventing CO 2 emissions. The business travel policy therefore envisages rail as the preferred means of transport.
310;Commerzbank_2022_EN-2;21;2;0.009523394517600536;0.9904766082763672;0.02072378434240818;0.04846116900444031;0.9194061160087585;0.011408851481974125;0.20418713986873627;0.31647342443466187;0.47933945059776306;;This also means avoiding air travel wherever possible. The Bank subsidises electric vehicles in its car leasing schemes. In addition, Commerzbank pays its employees in Germany a monthly mobility allowance of €20 for commuting by public transport an d provides support for another climate-friendly alternative via cycling initiatives.
311;Commerzbank_2022_EN-2;21;2;0.9501230716705322;0.04987688362598419;;;;;;;;;Key figure: In 2022, Comm erzbank Aktiengesellschaft generated 78,402 tonnes of CO 2-equivalent total emissions. This is slightly high er than in 2021, which was heavily impacted by coronavirus measures, but well below the emissions of previous years.
312;Commerzbank_2022_EN-2;21;2;0.40238654613494873;0.5976134538650513;0.029864653944969177;0.13182926177978516;0.8309756517410278;0.007330495398491621;0.29417574405670166;0.014457842335104942;0.6913664937019348;;The reasons for this in clude technical adaptations for energy efficiency in building management and changes in occupational mobility, as well as site closures and job reductions over the past two years. These measures will continue to have an effect even after the coronavirus restrictions have come to an end.
313;Commerzbank_2022_EN-2;21;2;0.9370876550674438;0.06291236728429794;;;;;;;;;We had set ourselves the goal of reducing our greenhouse gas emissions by 30% by 2025 (relative to the base year 2018). We in fact achieved this goal in 2022, with our CO 2-equivalent emissions of 78,402 tonnes equating to a decrease of 34.9%.
