;pdf_name;page_nr;page_section;climate_related_no;climate_related_yes;domain_MetricsTargets;domain_RiskManagement;domain_Strategy;domain_Governance;ron_risk;ron_opportunity;ron_neutral;transition_risk_label;text
314;Commerzbank_2022_EN-2;21;3;0.003828486194834113;0.9961715340614319;0.910276472568512;0.013375986367464066;0.06557393074035645;0.010773624293506145;;;;;Achieving our 2025 climate target early motivates us to define a new, medium-term climate target as the next step towards our commitment of net zero by 2040. The focus is on optimizing resource consumption, especially where our actions can have a direct impact on the environment0102030405060708090100 2020 2021 2022Total CO2equivalent emissions 1,000 tons 84.0 71.278.4.
315;Commerzbank_2022_EN-2;22;0;0.9504071474075317;0.049592867493629456;;;;;;;;;To our Shareholders Corporate Responsibility Management Report Risk Report Fina ncial Statements Further Information 63 25 Declaration on corporate governance pursuant to Art. 315d in conjunction with Art. 289f of the German Commercial Code (HGB) 36 Details pursuant to Art.
316;Commerzbank_2022_EN-2;22;0;0.9185898303985596;0.08141025900840759;;;;;;;;;315 of the German Commercial Code (HGB) 42 Non-financial report We have been offsetting Co mmerzbank Aktiengesellschaft’s currently unavoidable emissions in Germany since 2015, and globally since 2021. The Bank thus operates in a mathematically climate-neutral manner.
317;Commerzbank_2022_EN-2;22;0;0.004362902138382196;0.9956371188163757;0.9490542411804199;0.007212309166789055;0.03361814469099045;0.01011531613767147;;;;;Operational CO 2 emissions of Commerzbank Aktiengesellschaft 2022 Tonnes CO 2 equivalents Germany Other countries Total Scope 1 20,091 1,522 21,613 Scope 2 location- based 54,448 7,468 61,916 Scope 2 market-based 8,239 4,618 12,857 Scope 3 38,890 5,042 43,932 Total 67,220 11,182 78,402 The table shows the CO 2 emissions of Commerzbank Aktien- gesellschaft according to the gl obal categorisation.
318;Commerzbank_2022_EN-2;22;0;0.004797172266989946;0.9952027797698975;0.8031347393989563;0.025105111300945282;0.154168963432312;0.01759118027985096;;;;;by the Greenhouse Gas (GHG) Protocol.
319;Commerzbank_2022_EN-2;22;0;0.9489741921424866;0.051025815308094025;;;;;;;;;Scope 1 designates the emissions caused directly, for example through the consumption of natural gas, heating oil or fuel. Scope 2 refers to emissions from purchased energy. These can be calculated based on either the energy mix actually purchased (“market-based”) or the statistical country mix (“location-based”). We use market-based scope 2 emissions to calculate our total emissions.
320;Commerzbank_2022_EN-2;22;1;0.2583565413951874;0.7416434288024902;0.36058592796325684;0.20700514316558838;0.4139164388179779;0.018492404371500015;0.20842285454273224;0.1315024495124817;0.6600747108459473;;Scope 3 captures other indirect emissions from the upstream and downstream value chain. These include paper and water consumption, business travel and commuting, and other emissions from energy supply. The indirect emissions from our financial products (“financed emissions”) are not included in the calculation of the operational CO 2 footprint.
321;Commerzbank_2022_EN-2;22;1;0.0065391287207603455;0.9934608936309814;0.13874611258506775;0.4451264441013336;0.38771483302116394;0.02841268852353096;;;;;Commerzbank determines its greenhouse gas emissions on the basis of the standard developed by the Association for Environmental Management and Sustainability in Financial Institutions (VfU). This is based on international guidelines for environmental and climate reporting, such as the Greenhouse Gas Protocol, CDP and the Global Reporting Initiative. Emissions are calculated as CO 2 equivalents.
322;Commerzbank_2022_EN-2;22;1;0.9742754697799683;0.02572457678616047;;;;;;;;;Embodying collegiality The corporate success of the Commerzbank Group is based on qualified and motivated employees. Our 41,909 colleagues worldwide contributed their knowledge and experience to our work processes in 2022.
323;Commerzbank_2022_EN-2;22;1;0.9932524561882019;0.006747596897184849;;;;;;;;;"A fundamental appreciation of the importance of fairness, respect of others and lived diversity is anchored in our ComWerte and our code of conduct; it is our responsibility as an employer to ensure its implementation. Commerzbank Aktiengesellschaft aims to offer its staff a working environment characterised by a spirit of partnership."
324;Commerzbank_2022_EN-2;22;2;0.9828619956970215;0.017138032242655754;;;;;;;;;Our human resources policy makes it possible to promote the development of each individual employee and collegial cooperation, even in a challenging economic setting. The ongoing implementation of the Bank’s current restructuring will continue to entail job losses.
325;Commerzbank_2022_EN-2;22;2;0.9266480803489685;0.07335193455219269;;;;;;;;;To this end, Commerzbank Aktiengesellschaft agreed a framework social plan with the employee representatives at the end of 2021, with the aim of achieving fair job reductions that are as socially responsible as possible. In the year under review, we successfully pushed ahead with the headcount reductions re quired under the transformation.
326;Commerzbank_2022_EN-2;22;2;0.9913172721862793;0.00868277158588171;;;;;;;;;The vast majority of employees who departed the Bank did so under retirement arrangements. In addition, many employees were able to find new prospects with the support of new placement consulting. The Bank is working very hard to complete the remaining headcount reductions as quickly as possible and in a socially responsible manner.
327;Commerzbank_2022_EN-2;22;2;0.945787250995636;0.0542127899825573;;;;;;;;;The focus on digitalisation means that in certain areas we increasingly need different skillsets and job profiles than we did in the past. That is why we are positioning ourselves accordingly for this target group in order to attract suitable experts. At the same time, it is important to countera ct demographic change.
328;Commerzbank_2022_EN-2;22;3;0.8790394067764282;0.12096062302589417;;;;;;;;;Initiatives to ensure that the Bank has a heal thy pipeline of future talent are firmly embedded in the HR strategy: our extensive training offering, innovative learning programmes and the opportunity to pursue many different development paths should make the Bank attractive for tale nted young people.
329;Commerzbank_2022_EN-2;22;3;0.9772676229476929;0.0227324478328228;;;;;;;;;Developing employees Commerzbank Aktiengesellschaft offers a host of optional and mandatory training modules, such as seminars, workshops and e-learning courses, designed to prepare employees for the transformation of the banking sector resulting from digitalisation and develop their skills on an ongoing basis.
330;Commerzbank_2022_EN-2;22;3;0.9042885303497314;0.09571149945259094;;;;;;;;;In July 2022, a voluntary basic qualification on the topic of sustainability was also rolled out for all Commerzbank Aktiengesellschaft employees in Germany. The training programme is inte nded to ensure a common We treat our employees fairly and responsibly.
331;Commerzbank_2022_EN-2;23;0;0.9524218440055847;0.04757818207144737;;;;;;;;;64 Commerzbank Annual Report 2022 understanding of sustainability an d to strengthen our expertise as contact partners for sustainability matters. We are also shaping the increasingly digital working world within the Group through change s in work structures: mobile technical applications, agile working, and flexible workplaces and working hours are just a few of the keywords in this context.
332;Commerzbank_2022_EN-2;23;0;0.8622083067893982;0.1377916932106018;;;;;;;;;Commerz Real, for example, offers a model in which employees can choose between variable working hours and trust-based flexitime. It also attaches great importance to the ongoing training of its employees.
333;Commerzbank_2022_EN-2;23;0;0.9511777758598328;0.048822201788425446;;;;;;;;;Virtual formats such as the Sustainability Session and Digi Sessions are a platform for cross-disciplinary presentation and discussion of topics such as sustainability and digitalisation in the real estate and renewable energy sectors and in equipment leasing.
334;Commerzbank_2022_EN-2;23;0;0.9331840872764587;0.06681597232818604;;;;;;;;;The “Lernzeit+” (Learning Time+) model was added in 2022 and allows all employees to devote up to 12 hours of their working time per quarter to continuing education or training opportunities of their choice. Maintaining health Health is the basis for a properly functioning organisation and workforce alike.
335;Commerzbank_2022_EN-2;23;0;0.8718999624252319;0.12810005247592926;;;;;;;;;That makes strategic health management another key element in Commerzbank Aktiengesellschaft’s HR activities. 2022 was once again affected by the coronavirus pandemic, and Commerzbank was not alone in facing the major challenge of reconciling employee health protection with operational requirements.
336;Commerzbank_2022_EN-2;23;0;0.8475223779678345;0.15247760713100433;;;;;;;;;A hygiene and social distancing concept was established and kept regularly updated, and opportunities for remote working were extended. However, demands in the world of work are also changing independently of coronavirus. We want to empower employees and managers to deal with this change un der their own responsibility and in a way that promotes health.
337;Commerzbank_2022_EN-2;23;1;0.8885089159011841;0.11149104684591293;;;;;;;;;To this end, we offer them a wide range of preventive measures such as professional advisory and information services, for instance on how to deal with stress. The employee offering includes a wide array of flexible formats, such as webinars, audio formats and video consultations with company doctors and with Employee Assistance Programme advisors.
338;Commerzbank_2022_EN-2;23;1;0.9674896001815796;0.03251037001609802;;;;;;;;;Employees of Commerzbank and participating (domestic) subsidiaries can also use the self-service facility to book appointments for consultations and advisory sessions. As part of the Sustainability Report in accordance with the Global Reporting Initiative (GRI Report), we provide detailed information on personnel-related topics. The same applies to Commerz Real.
339;Commerzbank_2022_EN-2;23;1;0.9196036458015442;0.0803963840007782;;;;;;;;;As part of its commitment to its employees’ health and satisfaction, the company both develops its own concepts and implements measures in cooperation with the parent company. In 2022, Commerz Real began rolling out the new “Com.Wor k” office concept across the board. Employees can get involved in redesigning the office space.
340;Commerzbank_2022_EN-2;23;2;0.8012147545814514;0.19878529012203217;;;;;;;;;In addition to offices that can be booked flexibly, spaces are also being created for intensive video calls, interaction or relaxation, for example. mBank employees are also receiving support during the coronavirus pandemic. A hybrid model combining home and on- site working was put in place in May 2022.
341;Commerzbank_2022_EN-2;23;2;0.032497670501470566;0.9675023555755615;0.011000069789588451;0.30884015560150146;0.6554915904998779;0.024668153375387192;0.024208778515458107;0.41189613938331604;0.563895046710968;;Hybrid working is implemented according to the specific circumstances in sales and contracts units, in operations and in IT. It combines the advantages of office work and working from home and allows the best workplace to be chosen based on the specific tasks to be done. mBank has also launched the “Energised for Health” advice programme.
342;Commerzbank_2022_EN-2;23;2;0.8781026005744934;0.1218973845243454;;;;;;;;;This includes courses and training to help employees cope with stress and pressure. Promoting diversity and equal opportunities A working environment that is free from prejudice, typified by mutual respect and acceptance is essential for an atmosphere where everyone is able to thrive. We do not tolerate discrimination at Commerzbank .
343;Commerzbank_2022_EN-2;23;3;0.9183592796325684;0.08164066821336746;;;;;;;;;Any form of unfavourable treatment of people based on th eir gender, nationality, ethnic origin, religion or beliefs, disability, age, sexual orientation or gender identity constitutes a violation of human dignity and infringement of personal rights. Health is the foundation for the Performance of an organization and its workforce alike.
344;Commerzbank_2022_EN-2;24;0;0.9504071474075317;0.049592867493629456;;;;;;;;;To our Shareholders Corporate Responsibility Management Report Risk Report Fina ncial Statements Further Information 65 25 Declaration on corporate governance pursuant to Art. 315d in conjunction with Art. 289f of the German Commercial Code (HGB) 36 Details pursuant to Art.
345;Commerzbank_2022_EN-2;24;0;0.9185898303985596;0.08141025900840759;;;;;;;;;315 of the German Commercial Code (HGB) 42 Non-financial report HR geared to different phases of life For more than three de cades, our Diversity Management unit has been working to achieve an open and fair environment throughout the Group in which everyone feels appreciated. The focus is on the different perspectives and talents that our employees bring.
346;Commerzbank_2022_EN-2;24;0;0.033466994762420654;0.9665330648422241;0.055045075714588165;0.030963711440563202;0.8954368233680725;0.01855442114174366;0.17963828146457672;0.14027538895606995;0.6800863742828369;;Globally, the Group employs people from 120 nations. Their diverse origins vitalise and enrich interactions. Differences in viewpoint and experience lead to new ideas. Avoiding pay discrimination is a key concern for us, so all the Bank’s remuneration components and othe r benefits are designed to be gender-neutral and transparent.
347;Commerzbank_2022_EN-2;24;0;0.8247332572937012;0.17526671290397644;;;;;;;;;Like its parent company, Commerz Real is a signatory to the Diversity Charter. As a result, employee awareness of the issues of diversity and inclusion is raised through presentations, and human resources processes are checked to determine whether they ensure equal opportunities and diversity.
348;Commerzbank_2022_EN-2;24;1;0.8733803033828735;0.12661968171596527;;;;;;;;;In Poland, too, mBank is further developing its Diversity and Inclusion Policy and is a signatory to the Diversity Charte r of the Responsible Business Forum. The Diversity and Inclusion Policy not only summarises mBank’s efforts to date, but is also as a key component of the strategy for the coming years, in keeping with the ESG social responsibility goals.
349;Commerzbank_2022_EN-2;24;1;0.948878288269043;0.05112168565392494;;;;;;;;;Since 2022, all employees have completed e-lear ning courses on the topics of diversity and inclusion. In January 2022, mBank was for the second time listed in the global Bloomberg Gender Equality Index, which tracks the performance of public companies that actively promote gender equality in their working environment. mBank is also included on the “Diversity IN Check” list for 2022.
350;Commerzbank_2022_EN-2;24;1;0.9329068660736084;0.06709315627813339;;;;;;;;;This is published by the Responsible Business Forum and recognises the employers in Poland who are setting the bar in their management of diversity and inclusion. Work-life balance Alongside professional development, work-life balance is an important aspect of remaining attractive as a business.
351;Commerzbank_2022_EN-2;24;1;0.9041065573692322;0.09589339792728424;;;;;;;;;Within Commerzbank Aktiengesellschaft, this balance is ensured by concepts for different stages of life with specific offerings, such as flexible working time models, sabbaticals and programmes to facili tate the return to work after parental leave. We also offer advisory and support services relating to childcare, home care and care for the elderly through pme Familienservice.
352;Commerzbank_2022_EN-2;24;2;0.9689624309539795;0.03103753551840782;;;;;;;;;With an ageing workforce, taking care of relatives is becoming increasingly important. As a result, there is higher demand for our care-related workshops and advisory services. Gruner + Jahr Verlag once again recognised our engagement in 2022 by naming us one of th e best employers for women.
353;Commerzbank_2022_EN-2;24;2;0.9091967940330505;0.09080321341753006;;;;;;;;;In 2022, we agreed with the Works Council that we would continue and expand the working from home arrangements in Germany even after the coronavirus measures have been lifted.
354;Commerzbank_2022_EN-2;24;2;0.8487953543663025;0.15120460093021393;;;;;;;;;"P r o v i d e d t h a t r e m o t e w o r k i n g i s f e a s i b l e f r o m a n o p e r a t i o n a l perspective, branch employees can work remotely for up to 50% of their working hours; at headquarters and in the digital consulting centres, the figure is as high as 70%."
355;Commerzbank_2022_EN-2;24;2;0.916860818862915;0.08313922584056854;;;;;;;;;In addition to the positive experiences with flexible working during the coronavirus pandemic, the overriding factor that persuaded us to take this step was the clear desire of the workforce for greater flexibility in where they work.
356;Commerzbank_2022_EN-2;24;2;0.969332218170166;0.03066776879131794;;;;;;;;;Job-Sharing Two employees share one positionSabbatical Time off 3 to 12 months Mobile Working makes it possible to work independent of location from tome to time Expanded re-entry guarantee after parental leaveKEEP IN TOUCH for mothers and fathers during parental leave Flexible working time models to reconcile work and private lifeKids & Co ChildcareWorking part-time Interim part-time and trial.
357;Commerzbank_2022_EN-2;24;2;0.9487093687057495;0.0512906052172184;;;;;;;;;part-time Partner for family services pme-Familienservice Home & Elder Care Taking care for relatives People from 120 nations are employed at the Commerzbank Group worldwide.
358;Commerzbank_2022_EN-2;25;0;0.9590123891830444;0.04098764806985855;;;;;;;;;66 Commerzbank Annual Report 2022 Although a small majority of Commerzbank staff are female (around 51%), women are not yet represented at management level to the same extent. For this reason, in recent years the measures designed to promote a good work-life balance have been further improved to open up fresh career opportunities for women in particular.
359;Commerzbank_2022_EN-2;25;0;0.9502151012420654;0.04978495463728905;;;;;;;;;These include company childcare, innovative part-time models – including for managers – and structured return-to- work options to prevent careers from stalling. These measures have enabled Commerzbank to increase the proportion of women in leadersh ip positions to more than 30% Group-wide over the past few years.
360;Commerzbank_2022_EN-2;25;0;0.9476742744445801;0.05232568457722664;;;;;;;;;Our Board of Managing Directors has set a new goal of 40% across all management levels (management levels 1–4 and level-5 project managers) by the end of 2030. All divisions of Comm erzbank Aktienge sellschaft are explicitly tasked with actively approaching suitable female employees during the recruitment process.
361;Commerzbank_2022_EN-2;25;0;0.8900192975997925;0.1099807396531105;;;;;;;;;The Bank therefore launched dedicated projects in 2022, putting diversity and inclusion on the strategic issues agenda. For example, one Risk Management initiative focused on equality, mental health and internationalism under the banner “Colourful Group Risk Management”. Group Services also celebrated the lived diversity of its workforce through the “COO.bunt” (COO.colourful) campaign.
362;Commerzbank_2022_EN-2;25;1;0.9599008560180664;0.04009917750954628;;;;;;;;;The aim is to further in crease the proportion of female candidates for management positions when filling new positions. That is why the task of identifying, retaining and developing talent and high performers has been written into the HR strategy guidelines.
363;Commerzbank_2022_EN-2;25;1;0.9898861646652222;0.010113909840583801;;;;;;;;;In addition, all areas within the Board of Managing Directors have set their own equali ty targets, which together add up to a target of 40% of management positions held by women by 2030. Key figure: At the end of 2022, 35.0% of management positions across the Group were held by women. Driving inclusion The inclusion of people with disabilities is another part of our diversity strategy.
364;Commerzbank_2022_EN-2;25;1;0.6872007846832275;0.3127991557121277;;;;;;;;;Barrier-free access to the workplace and to working tools is just as high a priority as the implementation of accessibility in our digital offerings for customers. Commerzbank Aktiengesellschaft has consistently exceeded the statutory requirement of 5% employees with disabilities in recent years. We met this quota again in 2022 (5.9%).
365;Commerzbank_2022_EN-2;25;2;0.8335544466972351;0.1664455384016037;;;;;;;;;We are now devoting more attention to the next generation: in 2022 we advertised for the first time on myAbility, a job platform for people with disabilities that aims to further promote diversity and inclusion.
366;Commerzbank_2022_EN-2;25;2;0.9624731540679932;0.03752685710787773;;;;;;;;;Treating each other with respect Commerzbank Aktiengesellschaft is committed to an op en approach in respect of the sexual orientation and gender identity of its staff, customers and business contacts. This is achieved through education and various formats for dialogue, such as digital events and communication about queer people.
367;Commerzbank_2022_EN-2;25;2;0.9372075200080872;0.06279249489307404;;;;;;;;;Formats covering the topics of coming out, subconscious reservations and overarching diversity issues such as families and cross-cultural understanding are particularly popular with employees. These are also regularly attended by members of the Board of Managing Directors and executives.
368;Commerzbank_2022_EN-2;25;2;0.9673570394515991;0.03264297544956207;;;;;;;;;We want to embrace diversity in our language as well, so we decided in April 2022 to launch a one-year pilot with a recommendation on inclusive lang uage. We are initially gathering experience with this recommendation in internal publications, with the aim of communicating in a more accessible, value-neutral and gender-sensitive manner.
369;Commerzbank_2022_EN-2;25;2;0.9272819757461548;0.0727180764079094;;;;;;;;;Through publication of the “Prout Performer” lists, the Prout@Work Foundation recognises individuals from business and public life who stand up for the interests of lesbian, gay, bisexual, trans, inter and queer people and become role models. Ten Commerzbank employees received awards in the year under review. 010203040 2020 2021 2022Percentage of women in leadership positions 33.3 33.735.0.
370;Commerzbank_2022_EN-2;26;0;0.9504071474075317;0.049592867493629456;;;;;;;;;To our Shareholders Corporate Responsibility Management Report Risk Report Fina ncial Statements Further Information 67 25 Declaration on corporate governance pursuant to Art. 315d in conjunction with Art. 289f of the German Commercial Code (HGB) 36 Details pursuant to Art.
371;Commerzbank_2022_EN-2;26;0;0.9185898303985596;0.08141025900840759;;;;;;;;;315 of the German Commercial Code (HGB) 42 Non-financial report The topic of diversity was also addressed in public initiatives. This included, for example, the #t heLworksout campaign initiated by the ARCO employee network to mark Lesbian Visibility Day. Like the Commerzbank campaign #togetHERstronger, this was one of the finalists for the German Business Communication Award.
372;Commerzbank_2022_EN-2;26;0;0.9200393557548523;0.07996068149805069;;;;;;;;;Commerzbank takes a clear stance in public too and underlines this with visuals following the mo tto “We live diversity 365 days a year”. As in the previous year, the Commerzbank Tower was lit up to celebrate Pride, and colourfu l versions of the Bank’s logo appeared in digital channels and applications. Ensuring integrity and compliance Integrity is the basis of our business model.
373;Commerzbank_2022_EN-2;26;0;0.9479045271873474;0.052095524966716766;;;;;;;;;We act in an attentive, trust-worthy and reliable manner. The globally binding Code of Conduct was updated in the first quarter of 2022 and summarises our understanding of impeccable ethical and moral behaviour. It go es beyond legal and regulatory requirements and sets standards for Commerzbank Group employees and service providers.
374;Commerzbank_2022_EN-2;26;1;0.9682337641716003;0.03176620230078697;;;;;;;;;The focus of Commerzbank’s compliance activities is on preventing and uncovering money laundering, terrorist financing, market abuse (insider trading and market manipulation), fraud, corruption and other criminal acts wherever the Bank does business, as well as on protecting investors.
375;Commerzbank_2022_EN-2;26;1;0.9924565553665161;0.007543473970144987;;;;;;;;;We also ensure that insider information and other confidential data about our customers and their transactions ar e protected in accordance with the need-to-know principle.
376;Commerzbank_2022_EN-2;26;1;0.8984355926513672;0.10156435519456863;;;;;;;;;Commerzbank Aktiengesellschaft’s Compliance division has wide-ranging authority and escalation rights, including powers to obtain information and carry out investigations, enabling it to implement its requirements throughout the Group.
377;Commerzbank_2022_EN-2;26;1;0.977985143661499;0.022014882415533066;;;;;;;;;Managing compliance risks As a proactive risk manager, Group Compliance manages compliance risk throughout the Group and thus lays the foundation for compliance with laws, ethical standards and regulations. Our goal is to effectively manage compliance risks and identify them at an early stage before they materialise.
